ifcbName,timeDelta,caloosLink,gsheetsStatus
IFCB Santa Cruz Wharf,"9 days, 1 hours, 11 minutes",https://ifcb.caloos.org/santa-cruz-municipal-wharf,"(None,)"
IFCB Bodega Marine Lab,"13 hours, 4 minutes",https://ifcb.caloos.org/bodega-marine-lab,"(None,)"
IFCB Cal Poly Humboldt,No data within the last 60 days,https://ifcb.caloos.org/cal-poly-humboldt-hioc,"(None,)"
IFCB MBARI Power Buoy,"14 hours, 20 minutes",https://ifcb.caloos.org/mbari-power-buoy,"(None,)"
IFCB San Francisco Pier 17,No data within the last 60 days,https://ifcb.caloos.org/san-francisco-pier-17,"(None,)"
